commit	dice	memory_gb	status	description	command
bf8310f	0.806790	0.1	discard	sphere k150 t50 ls-0.5 s3 (0.807; s1/s2/s3=0.840/0.831/0.807 mean 0.826±0.018; seed variance ±0.018, method robust)	uv run python scripts/run_pipeline.py --stages train,trunc,eval,export,viz --iters 5000 --max-steps 128 --stock-size-in 1 1 1 --voxel-size-mm 0.5 --target-shape sphere --target-radius-mm 11.43 --target-height-mm 22.86 --post haas --dt 0.45 --learning-rate 1e-3 --grad-clip 0.5 --eval-freq 10 --tool-height-mm 50.0 --k-anneal --k-init 10 --k-final 150 --loss-shift -0.5 --seed 3
bf8310f	0.655990	0.1	keep	sphere_bowl k150 t50 ls-0.5 s2 (0.656; bowl s1/s2=0.613/0.656 mean 0.634±0.030; ls-0.5 neutral on bowl, matches k150-only)	uv run python scripts/run_pipeline.py --stages train,trunc,eval,export,viz --iters 5000 --max-steps 128 --stock-size-in 1 1 1 --voxel-size-mm 0.5 --target-shape sphere_bowl --target-radius-mm 11.43 --target-height-mm 22.86 --target-sub-radius-mm 9.525 --post haas --dt 0.45 --learning-rate 1e-3 --grad-clip 0.5 --eval-freq 10 --tool-height-mm 50.0 --k-anneal --k-init 10 --k-final 150 --loss-shift -0.5 --seed 2
bf8310f	0.909580	0.1	keep	cylinder k150 t50 ls-0.5 s2 (0.910; cyl s1/s2/s3=0.895/0.910/0.913 mean 0.905±0.010; s1 was low outlier)	uv run python scripts/run_pipeline.py --stages train,trunc,eval,export,viz --iters 5000 --max-steps 128 --stock-size-in 1 1 1 --voxel-size-mm 0.5 --target-shape cylinder --target-radius-mm 11.43 --target-height-mm 22.86 --post haas --dt 0.45 --learning-rate 1e-3 --grad-clip 0.5 --eval-freq 10 --tool-height-mm 50.0 --k-anneal --k-init 10 --k-final 150 --loss-shift -0.5 --seed 2
bf8310f	0.912670	0.1	keep	cylinder k150 t50 ls-0.5 s3 (0.913; cyl mean 0.905±0.010 robust)	uv run python scripts/run_pipeline.py --stages train,trunc,eval,export,viz --iters 5000 --max-steps 128 --stock-size-in 1 1 1 --voxel-size-mm 0.5 --target-shape cylinder --target-radius-mm 11.43 --target-height-mm 22.86 --post haas --dt 0.45 --learning-rate 1e-3 --grad-clip 0.5 --eval-freq 10 --tool-height-mm 50.0 --k-anneal --k-init 10 --k-final 150 --loss-shift -0.5 --seed 3
bf8310f	0.632290	0.1	keep	sphere_bowl k150 t50 ls-0.5 s3 (0.632; bowl s1/s2/s3=0.613/0.656/0.632 mean 0.634±0.020; ls-0.5 neutral on bowl, robust)	uv run python scripts/run_pipeline.py --stages train,trunc,eval,export,viz --iters 5000 --max-steps 128 --stock-size-in 1 1 1 --voxel-size-mm 0.5 --target-shape sphere_bowl --target-radius-mm 11.43 --target-height-mm 22.86 --target-sub-radius-mm 9.525 --post haas --dt 0.45 --learning-rate 1e-3 --grad-clip 0.5 --eval-freq 10 --tool-height-mm 50.0 --k-anneal --k-init 10 --k-final 150 --loss-shift -0.5 --seed 3
bf8310f	0.773700	0.1	keep	sphere 2in k150 t100 ls-0.5 s1 (viz=train=0.774 NO-TRUNC; full method SCALES to 2in - vs 1in 0.826 the gap is tool-to-stock ratio; 2in k10 ~0.55 so k-anneal +0.22 scales)	uv run python scripts/run_pipeline.py --stages train,trunc,eval,export,viz --iters 5000 --max-steps 128 --stock-size-in 2 2 2 --voxel-size-mm 0.5 --target-shape sphere --target-radius-mm 22.86 --target-height-mm 22.86 --post haas --dt 0.45 --learning-rate 1e-3 --grad-clip 0.5 --eval-freq 10 --tool-height-mm 100.0 --k-anneal --k-init 10 --k-final 150 --loss-shift -0.5 --seed 1
bf8310f	0.580440	0.1	keep	pyramid 2in k150 t100 ls-0.5 s1 (viz=train=0.580 NO-TRUNC; 2in pyramid harder than 1in 0.813 - more surface, tool-to-stock ratio)	uv run python scripts/run_pipeline.py --stages train,trunc,eval,export,viz --iters 5000 --max-steps 128 --stock-size-in 2 2 2 --voxel-size-mm 0.5 --target-shape pyramid --target-radius-mm 22.86 --target-height-mm 45.72 --post haas --dt 0.45 --learning-rate 1e-3 --grad-clip 0.5 --eval-freq 10 --tool-height-mm 100.0 --k-anneal --k-init 10 --k-final 150 --loss-shift -0.5 --seed 1
bf8310f	0.942740	0.1	keep	box 2in k150 t100 ls-0.5 s1 (viz=train=0.943 NO-TRUNC; 2in box BEATS 1in 0.865 - z-invariant cross-section scales well, more voxels = finer resolution)	uv run python scripts/run_pipeline.py --stages train,trunc,eval,export,viz --iters 5000 --max-steps 128 --stock-size-in 2 2 2 --voxel-size-mm 0.5 --target-shape box --target-radius-mm 22.86 --target-height-mm 22.86 --post haas --dt 0.45 --learning-rate 1e-3 --grad-clip 0.5 --eval-freq 10 --tool-height-mm 100.0 --k-anneal --k-init 10 --k-final 150 --loss-shift -0.5 --seed 1
bf8310f	0.744370	0.1	keep	sphere 2in k150 t100 ls-0.5 s3 (0.744; sphere 2in s1/s3=0.774/0.744 mean 0.759)	uv run python scripts/run_pipeline.py --stages train,trunc,eval,export,viz --iters 5000 --max-steps 128 --stock-size-in 2 2 2 --voxel-size-mm 0.5 --target-shape sphere --target-radius-mm 22.86 --target-height-mm 22.86 --post haas --dt 0.45 --learning-rate 1e-3 --grad-clip 0.5 --eval-freq 10 --tool-height-mm 100.0 --k-anneal --k-init 10 --k-final 150 --loss-shift -0.5 --seed 3
bf8310f	0.754750	0.1	keep	sphere 2in k150 t100 ls-0.5 s2 (0.755; sphere 2in s1/s2/s3=0.774/0.755/0.744 mean 0.758±0.012 robust)	uv run python scripts/run_pipeline.py --stages train,trunc,eval,export,viz --iters 5000 --max-steps 128 --stock-size-in 2 2 2 --voxel-size-mm 0.5 --target-shape sphere --target-radius-mm 22.86 --target-height-mm 22.86 --post haas --dt 0.45 --learning-rate 1e-3 --grad-clip 0.5 --eval-freq 10 --tool-height-mm 100.0 --k-anneal --k-init 10 --k-final 150 --loss-shift -0.5 --seed 2
bf8310f	0.575840	0.1	keep	pyramid 2in k150 t100 ls-0.5 s2 (0.576; pymr 2in s1/s2=0.580/0.576 mean 0.578)	uv run python scripts/run_pipeline.py --stages train,trunc,eval,export,viz --iters 5000 --max-steps 128 --stock-size-in 2 2 2 --voxel-size-mm 0.5 --target-shape pyramid --target-radius-mm 22.86 --target-height-mm 45.72 --post haas --dt 0.45 --learning-rate 1e-3 --grad-clip 0.5 --eval-freq 10 --tool-height-mm 100.0 --k-anneal --k-init 10 --k-final 150 --loss-shift -0.5 --seed 2
bf8310f	0.574560	0.1	keep	pyramid 2in k150 t100 ls-0.5 s3 (0.575; pymr 2in s1/s2/s3=0.580/0.576/0.575 mean 0.577±0.002 robust)	uv run python scripts/run_pipeline.py --stages train,trunc,eval,export,viz --iters 5000 --max-steps 128 --stock-size-in 2 2 2 --voxel-size-mm 0.5 --target-shape pyramid --target-radius-mm 22.86 --target-height-mm 45.72 --post haas --dt 0.45 --learning-rate 1e-3 --grad-clip 0.5 --eval-freq 10 --tool-height-mm 100.0 --k-anneal --k-init 10 --k-final 150 --loss-shift -0.5 --seed 3
bf8310f	0.910660	0.1	keep	box 2in k150 t100 ls-0.5 s3 (0.911; box 2in s1/s3=0.943/0.911)	uv run python scripts/run_pipeline.py --stages train,trunc,eval,export,viz --iters 5000 --max-steps 128 --stock-size-in 2 2 2 --voxel-size-mm 0.5 --target-shape box --target-radius-mm 22.86 --target-height-mm 22.86 --post haas --dt 0.45 --learning-rate 1e-3 --grad-clip 0.5 --eval-freq 10 --tool-height-mm 100.0 --k-anneal --k-init 10 --k-final 150 --loss-shift -0.5 --seed 3
